{
  "schemaVersion": "archlens.migration-event.v1",
  "runId": "11111111-1111-4111-8111-111111111111",
  "revision": 1,
  "sequence": 2,
  "occurredAt": "2026-10-02T00:00:00Z",
  "type": "PLAN_DRAFTED",
  "artifactHash": "ab8b6474dd923e23df1b148c963c2a435de54149dbe10e24502dd41b69202026",
  "errorCode": null
}
